{
  "$schema": "https://json-schema.org/draft/2020-12/schema",
  "$id": "https://dangnhit.github.io/qa-tester/schemas/test-case.schema.json",
  "title": "Test Case",
  "type": "object",
  "additionalProperties": false,
  "required": [
    "artifactType",
    "schemaVersion",
    "producerVersion",
    "testCaseId",
    "revisionId",
    "instanceId",
    "title",
    "steps",
    "coverage"
  ],
  "properties": {
    "artifactType": {
      "const": "test-case"
    },
    "schemaVersion": {
      "const": "3.0.0"
    },
    "producerVersion": {
      "type": "string",
      "minLength": 1
    },
    "testCaseId": {
      "type": "string",
      "minLength": 1,
      "pattern": "^[^:]+$"
    },
    "revisionId": {
      "type": "string",
      "minLength": 1,
      "pattern": "^[^:]+$"
    },
    "instanceId": {
      "type": "string",
      "minLength": 1,
      "pattern": "^[^:]+$"
    },
    "title": {
      "type": "string",
      "minLength": 1
    },
    "steps": {
      "type": "array",
      "minItems": 1,
      "items": {
        "type": "object",
        "additionalProperties": false,
        "required": [
          "id",
          "action",
          "sideEffect"
        ],
        "properties": {
          "id": {
            "type": "string",
            "minLength": 1
          },
          "action": {
            "type": "string",
            "minLength": 1
          },
          "sideEffect": {
            "enum": [
              "none",
              "reversible",
              "external",
              "destructive"
            ]
          }
        }
      }
    },
    "regressionIndex": {
      "type": "object",
      "additionalProperties": false,
      "required": [
        "requirementIds",
        "codeSurfaces",
        "declaredDependencies",
        "gitPaths",
        "userScope"
      ],
      "properties": {
        "requirementIds": {
          "$ref": "#/$defs/strings"
        },
        "codeSurfaces": {
          "$ref": "#/$defs/strings"
        },
        "declaredDependencies": {
          "$ref": "#/$defs/strings"
        },
        "gitPaths": {
          "$ref": "#/$defs/strings"
        },
        "userScope": {
          "$ref": "#/$defs/strings"
        }
      }
    },
    "coverage": {
      "type": "object",
      "additionalProperties": false,
      "required": [
        "requirementId",
        "role",
        "behavior",
        "browser",
        "viewport",
        "accessibilityMethod",
        "risk",
        "outcome"
      ],
      "properties": {
        "requirementId": {
          "type": "string",
          "minLength": 1
        },
        "role": {
          "type": "string",
          "minLength": 1
        },
        "behavior": {
          "type": "string",
          "minLength": 1
        },
        "browser": {
          "type": "string",
          "minLength": 1
        },
        "viewport": {
          "type": "object",
          "additionalProperties": false,
          "required": [
            "width",
            "height"
          ],
          "properties": {
            "width": {
              "type": "integer",
              "minimum": 1
            },
            "height": {
              "type": "integer",
              "minimum": 1
            }
          }
        },
        "accessibilityMethod": {
          "description": "Same enum, same reason as coverage-obligation.accessibilityMethod: CONTEXT.md:437's four categories, or null for none declared. Nothing compares this value to an obligation's declared method — a declared label never satisfies an Accessibility Obligation by matching its own label (CONTEXT.md:439), so this field is informational only. It stays enum-constrained anyway so a free-form label here cannot reintroduce the same unauditable-claim problem the obligation's field was constrained to prevent.",
          "enum": [
            "automated-analysis",
            "keyboard",
            "screen-reader",
            "cognitive-manual",
            null
          ]
        },
        "risk": {
          "enum": [
            "low",
            "medium",
            "high",
            "critical"
          ]
        },
        "outcome": {
          "type": "string",
          "minLength": 1
        }
      }
    }
  },
  "$defs": {
    "strings": {
      "type": "array",
      "items": {
        "type": "string",
        "minLength": 1
      }
    }
  }
}
