{
  "artifactType": "test-case",
  "coverage": {
    "accessibilityMethod": null,
    "behavior": "模块: JumpServer / 控制台 / 用户管理 / 用户列表；验证: 用户列表：验证快速筛选",
    "browser": "chromium",
    "outcome": "[1] 页面显示无效的用户，包含禁用的，过期的用户\n[2] 页面显示已禁用的用户（未激活的用户）\n[3] 页面显示已过期的用户\n[4] 页面显示从未登录的用户",
    "requirementId": "MS-107668",
    "risk": "critical",
    "role": "console-admin",
    "viewport": {
      "height": 720,
      "width": 1280
    }
  },
  "producerVersion": "1.0.3",
  "regressionIndex": {
    "codeSurfaces": [
      "JumpServer",
      "控制台",
      "用户管理",
      "用户列表"
    ],
    "declaredDependencies": [],
    "gitPaths": [],
    "requirementIds": [
      "MS-107668"
    ],
    "userScope": [
      "console-admin"
    ]
  },
  "schemaVersion": "3.0.0",
  "steps": [
    {
      "action": "用户列表：快速筛选，点击无效的：筛选无效的用户",
      "id": "step-1",
      "sideEffect": "none"
    },
    {
      "action": "用户列表：快速筛选，点击禁用的：筛选禁用的用户",
      "id": "step-2",
      "sideEffect": "reversible"
    },
    {
      "action": "用户列表：快速筛选，点击过期的：筛选已过期的用户",
      "id": "step-3",
      "sideEffect": "none"
    },
    {
      "action": "用户列表：快速筛选，点击从未登录的：筛选从未登录的用户",
      "id": "step-4",
      "sideEffect": "none"
    }
  ],
  "testCaseId": "MS-107668",
  "title": "用户列表：验证快速筛选",
  "revisionId": "abd46fb497d2d1d5c140d3aa6539026119418bba864f2b0ea6c1854a3abccc1b",
  "instanceId": "MS-107668--abd46fb497d2d1d5"
}