{
  "artifactType": "test-case",
  "coverage": {
    "accessibilityMethod": null,
    "behavior": "模块: JumpServer / 控制台 / 用户管理 / 用户列表；验证: 用户管理-用户列表：创建用户，设置自定义的组织角色",
    "browser": "chromium",
    "outcome": "[1] 创建用户成功，使用该用户登录，用户拥有该自定义组织角色的权限",
    "requirementId": "MS-104329",
    "risk": "medium",
    "role": "console-admin",
    "viewport": {
      "height": 720,
      "width": 1280
    }
  },
  "producerVersion": "1.0.3",
  "regressionIndex": {
    "codeSurfaces": [
      "JumpServer",
      "控制台",
      "用户管理",
      "用户列表"
    ],
    "declaredDependencies": [],
    "gitPaths": [],
    "requirementIds": [
      "MS-104329"
    ],
    "userScope": [
      "console-admin"
    ]
  },
  "schemaVersion": "3.0.0",
  "steps": [
    {
      "action": "在创建用户表单上，组织角色选择自定义的组织角色，系统角色选择用户，其他按照要求填写，提交",
      "id": "step-1",
      "sideEffect": "reversible"
    }
  ],
  "testCaseId": "MS-104329",
  "title": "用户管理-用户列表：创建用户，设置自定义的组织角色",
  "revisionId": "ea74964d5132deac6b868d5d7ab1f1b2f810018efd793295fd5ab1f151324cb4",
  "instanceId": "MS-104329--ea74964d5132deac"
}