{
  "artifactType": "test-case",
  "coverage": {
    "accessibilityMethod": null,
    "behavior": "模块: JumpServer / 控制台 / 用户管理 / 用户列表；验证: 用户管理-用户列表-更新用户：更新用户密码",
    "browser": "chromium",
    "outcome": "[1] 更新成功。测试用户登录，使用新密码登录成功；使用旧密码登录失败，提示用户名或密码错误。",
    "requirementId": "MS-104869",
    "risk": "medium",
    "role": "console-admin",
    "viewport": {
      "height": 720,
      "width": 1280
    }
  },
  "producerVersion": "1.0.3",
  "regressionIndex": {
    "codeSurfaces": [
      "JumpServer",
      "控制台",
      "用户管理",
      "用户列表"
    ],
    "declaredDependencies": [],
    "gitPaths": [],
    "requirementIds": [
      "MS-104869"
    ],
    "userScope": [
      "console-admin"
    ]
  },
  "schemaVersion": "3.0.0",
  "steps": [
    {
      "action": "用户管理-用户列表-更新用户：更新用户密码，提交",
      "id": "step-1",
      "sideEffect": "reversible"
    }
  ],
  "testCaseId": "MS-104869",
  "title": "用户管理-用户列表-更新用户：更新用户密码",
  "revisionId": "0d6815454b9cd692963ac8b1681ac4de571a9541ca33112e2a81aaa7f27d65a0",
  "instanceId": "MS-104869--0d6815454b9cd692"
}