{
  "artifactType": "test-case",
  "coverage": {
    "accessibilityMethod": null,
    "behavior": "模块: JumpServer / 控制台 / 用户管理 / 用户列表；验证: 创建用户表单-查看一些字段使用select2组件，是否优化成 TableSelect2 组件",
    "browser": "chromium",
    "outcome": "[1] 有优化成 TableSelect2组件，可以批量选择，或批量删除\n[2] 有优化成 TableSelect2组件，可以批量选择，或批量删除\n[3] 有优化成 TableSelect2组件，可以批量选择，或批量删除",
    "requirementId": "MS-100211",
    "risk": "medium",
    "role": "console-admin",
    "viewport": {
      "height": 720,
      "width": 1280
    }
  },
  "producerVersion": "1.0.3",
  "regressionIndex": {
    "codeSurfaces": [
      "JumpServer",
      "控制台",
      "用户管理",
      "用户列表"
    ],
    "declaredDependencies": [],
    "gitPaths": [],
    "requirementIds": [
      "MS-100211"
    ],
    "userScope": [
      "console-admin"
    ]
  },
  "schemaVersion": "3.0.0",
  "steps": [
    {
      "action": "创建用户表单-添加用户组的select2组件，是否优化成 TableSelect2组件",
      "id": "step-1",
      "sideEffect": "reversible"
    },
    {
      "action": "创建用户表单-添加系统角色的select2组件，是否优化成 TableSelect2组件",
      "id": "step-2",
      "sideEffect": "reversible"
    },
    {
      "action": "创建用户表单-添加组织角色的select2组件，是否优化成 TableSelect2组件",
      "id": "step-3",
      "sideEffect": "reversible"
    }
  ],
  "testCaseId": "MS-100211",
  "title": "创建用户表单-查看一些字段使用select2组件，是否优化成 TableSelect2 组件",
  "revisionId": "f57904367e5fb27c4873bd9505dc62f796958a2e958503886b422507a0693ed8",
  "instanceId": "MS-100211--f57904367e5fb27c"
}