{
  "artifactType": "test-case",
  "coverage": {
    "accessibilityMethod": null,
    "behavior": "模块: JumpServer / 控制台 / 用户管理 / 用户列表；验证: 用户管理-用户列表：使用系统管理员创建普通用户",
    "browser": "chromium",
    "outcome": "[1] 返回创建用户表单。\n[2] 创建系统用户成功。返回用户列表，可查看到该用户信息，且系统角色字段显示系统管理员。使用该用户登录，其拥有的权限：只有工作台",
    "requirementId": "MS-104214",
    "risk": "high",
    "role": "org-user",
    "viewport": {
      "height": 720,
      "width": 1280
    }
  },
  "producerVersion": "1.0.3",
  "regressionIndex": {
    "codeSurfaces": [
      "JumpServer",
      "控制台",
      "用户管理",
      "用户列表"
    ],
    "declaredDependencies": [],
    "gitPaths": [],
    "requirementIds": [
      "MS-104214"
    ],
    "userScope": [
      "org-user"
    ]
  },
  "schemaVersion": "3.0.0",
  "steps": [
    {
      "action": "系统管理员登录。点击用户管理-用户列表：点击创建。",
      "id": "step-1",
      "sideEffect": "reversible"
    },
    {
      "action": "在创建用户表单上：填写名称、用户名、邮箱，系统角色选用户、组织角色选用户，其他按要求填写，提交",
      "id": "step-2",
      "sideEffect": "reversible"
    }
  ],
  "testCaseId": "MS-104214",
  "title": "用户管理-用户列表：使用系统管理员创建普通用户",
  "revisionId": "94382b0412c7021d283520557aaeb6d0ea6de24a6ac3488c171de15521510014",
  "instanceId": "MS-104214--94382b0412c7021d"
}