{
  "artifactType": "test-case",
  "coverage": {
    "accessibilityMethod": null,
    "behavior": "模块: JumpServer / 控制台 / 用户管理 / 用户列表；验证: 用户-详情页：更新用户表单优化为抽屉式表单（右侧弹出）",
    "browser": "chromium",
    "outcome": "[1] 右侧弹出抽屉式表单，并且表单显示该用户的对应信息\n[2] 更新用户成功。该详情页自动刷新，可查看到该用户的信息是更新后的信息。\n[3] 更新用户成功。该详情页自动刷新，，可查看到该用户的用户组信息是更新后信息\n[4] 更新用户成功。该详情页自动刷新，可查看到该用户的信息是正确的。使用该用户登录，提示要绑定MFA\n[5] 更新用户成功。使用该用户登录，使用新密码登录，登录成功\n[6] 更新用户成功。使用该用户登录，使用新的密钥登录，登录成功. ssh username@IP -p2222 -i ./新密钥文件  免密登录成功\n[7] 更新用户成功。该详情页自动刷新，可查看到该用户的信息是正确的。用户登录，拥有所选角色的权限\n[8] 更新用户成功。该详情页自动刷新，可查看到该用户的信息是正确的。且用户的有效字段是打岔的，且使用该用户登录失败。",
    "requirementId": "MS-100600",
    "risk": "high",
    "role": "console-admin",
    "viewport": {
      "height": 720,
      "width": 1280
    }
  },
  "producerVersion": "1.0.3",
  "regressionIndex": {
    "codeSurfaces": [
      "JumpServer",
      "控制台",
      "用户管理",
      "用户列表"
    ],
    "declaredDependencies": [],
    "gitPaths": [],
    "requirementIds": [
      "MS-100600"
    ],
    "userScope": [
      "console-admin"
    ]
  },
  "schemaVersion": "3.0.0",
  "steps": [
    {
      "action": "用户-详情页，点击更新用户",
      "id": "step-1",
      "sideEffect": "reversible"
    },
    {
      "action": "表单填写，更新名称、用户名、邮箱，其他按照要求填写",
      "id": "step-2",
      "sideEffect": "reversible"
    },
    {
      "action": "表单填写,更新用户组",
      "id": "step-3",
      "sideEffect": "reversible"
    },
    {
      "action": "表单填写,更新设置MFA开启/强制开启",
      "id": "step-4",
      "sideEffect": "reversible"
    },
    {
      "action": "表单填写,更新密码",
      "id": "step-5",
      "sideEffect": "reversible"
    },
    {
      "action": "表单填写,更新公钥",
      "id": "step-6",
      "sideEffect": "reversible"
    },
    {
      "action": "表单填写,更新系统角色/组织角色",
      "id": "step-7",
      "sideEffect": "reversible"
    },
    {
      "action": "表单填写,关闭激活",
      "id": "step-8",
      "sideEffect": "reversible"
    }
  ],
  "testCaseId": "MS-100600",
  "title": "用户-详情页：更新用户表单优化为抽屉式表单（右侧弹出）",
  "revisionId": "486bffe4f276f6c8b3863e89e3dafca318bc5831427f5300911b696c4e107c4b",
  "instanceId": "MS-100600--486bffe4f276f6c8"
}